{
  "$schema": "http://json-schema.org/draft-07/schema#",
  "title": "WTP standard profile (core/library/wtp/profiles/<id>.json)",
  "description": "A set of design criteria and defaults for one code, country or reference. The engine never hard-codes a criterion; it reads it from the active profile.",
  "type": "object",
  "required": ["id", "name", "units", "sources", "criteria"],
  "properties": {
    "id": { "type": "string" }, "name": { "type": "string" },
    "country": { "type": ["string", "null"] }, "region": { "type": ["string", "null"] },
    "units": { "enum": ["SI", "US"], "description": "Display units. Stored values are SI." },
    "sources": { "type": "array", "items": { "type": "string" }, "description": "Reference ids from references.json." },
    "waterQualityTargets": { "type": "object", "description": "Finished-water limits by parameter." },
    "criteria": { "type": "object", "description": "'<stage>.<type>' -> parameter -> { value | min | max, unit, source:{ref, loc} }." },
    "drawing": { "type": "object", "properties": { "sheetSeries": { "enum": ["A", "ANSI"] }, "scale": {}, "language": { "type": "string" } } },
    "currency": { "type": ["string", "null"] },
    "notes": { "type": "string" }
  }
}
